[
  {
    "id": "QA-RATIOPROP-000004",
    "subject": "quantitative_aptitude",
    "topic": "ratio-proportion",
    "subtopic": "coin_currency_problems",
    "difficulty": "medium",
    "question_type": "single_choice",
    "question": "A bag contains coins of \u20b91, 50 paise, and 25 paise in the ratio 5 : 6 : 8. If the total value of all coins in the bag is \u20b9400, find the total number of 50 paise coins.",
    "options": [
      "200",
      "240",
      "280",
      "320"
    ],
    "answer": "240",
    "explanation": "Let the number of coins be 5x, 6x, and 8x. Value of \u20b91 coins = 5x \u00d7 \u20b91 = \u20b95x. Value of 50p coins = 6x \u00d7 \u20b90.50 = \u20b93x. Value of 25p coins = 8x \u00d7 \u20b90.25 = \u20b92x. Total value = 5x + 3x + 2x = 10x. Given 10x = 400 => x = 40. Number of 50 paise coins = 6x = 6 \u00d7 40 = 240.",
    "estimated_time_seconds": 55,
    "tags": [
      "coins",
      "denominations",
      "currency-ratio"
    ]
  },
  {
    "id": "QA-RATIOPROP-000005",
    "subject": "quantitative_aptitude",
    "topic": "ratio-proportion",
    "subtopic": "age_problems",
    "difficulty": "medium",
    "question_type": "single_choice",
    "question": "The ratio of the present ages of a father and son is 7 : 2. Six years ago, the ratio of their ages was 6 : 1. What will be the ratio of their ages 6 years from now?",
    "options": [
      "3 : 1",
      "5 : 2",
      "7 : 3",
      "8 : 3"
    ],
    "answer": "8 : 3",
    "explanation": "Let present ages be 7x and 2x. Six years ago: (7x - 6) / (2x - 6) = 6 / 1 => 7x - 6 = 12x - 36 => 5x = 30 => x = 6. Present ages: Father = 42 years, Son = 12 years. Six years from now, father will be 48 and son will be 18. Ratio = 48 : 18 = 8 : 3.",
    "estimated_time_seconds": 60,
    "tags": [
      "ages",
      "ratio",
      "linear-equations"
    ]
  },
  {
    "id": "QA-RATIOPROP-000006",
    "subject": "quantitative_aptitude",
    "topic": "ratio-proportion",
    "subtopic": "distribution_division",
    "difficulty": "medium",
    "question_type": "single_choice",
    "question": "A sum of \u20b911,700 was to be divided among P, Q, and R in the ratio 2 : 3 : 4. By mistake, it was divided in the ratio (1/2) : (1/3) : (1/4). Which person gained the most due to this error, and by how much?",
    "options": [
      "P by \u20b92,800",
      "P by \u20b92,500",
      "Q by \u20b91,100",
      "R by \u20b92,600"
    ],
    "answer": "P by \u20b92,800",
    "explanation": "Intended distribution ratio = 2 : 3 : 4 (total 9 units). Intended shares: P = 2/9 \u00d7 11,700 = \u20b92,600; Q = 3/9 \u00d7 11,700 = \u20b93,900; R = 4/9 \u00d7 11,700 = \u20b95,200. Mistaken ratio: (1/2) : (1/3) : (1/4). Multiply by LCM 12 => 6 : 4 : 3 (total 13 units). Actual shares: P = 6/13 \u00d7 11,700 = \u20b95,400; Q = 4/13 \u00d7 11,700 = \u20b93,600; R = 3/13 \u00d7 11,700 = \u20b92,700. Comparing P: gained 5,400 - 2,600 = \u20b92,800. Q lost \u20b9300, R lost \u20b92,500. P gained the most, by \u20b92,800.",
    "estimated_time_seconds": 70,
    "tags": [
      "reciprocal-ratios",
      "distribution",
      "gain-loss"
    ]
  },
  {
    "id": "QA-RATIOPROP-000007",
    "subject": "quantitative_aptitude",
    "topic": "ratio-proportion",
    "subtopic": "proportion_variation",
    "difficulty": "medium",
    "question_type": "single_choice",
    "question": "The cost of a diamond varies directly as the square of its weight. A diamond weighing 12 carats accidentally breaks into two pieces whose weights are in the ratio 3 : 1. If the total loss in monetary value due to the breakage is \u20b945,000, what was the original cost of the unbroken diamond?",
    "options": [
      "\u20b990,000",
      "\u20b9108,000",
      "\u20b9120,000",
      "\u20b9144,000"
    ],
    "answer": "\u20b9120,000",
    "explanation": "Cost C = k \u00d7 W^2. Original diamond weight W = 12. Total parts = 3 + 1 = 4. Pieces weigh (3/4) \u00d7 12 = 9 carats and (1/4) \u00d7 12 = 3 carats. Original cost = k(12^2) = 144k. Cost of pieces = k(9^2 + 3^2) = k(81 + 9) = 90k. Loss in value = 144k - 90k = 54k. Given loss = 45,000 => 54k = 45,000 => k = 45,000 / 54 = 2500 / 3. Original cost = 144k = 144 \u00d7 (2500 / 3) = 48 \u00d7 2500 = \u20b9120,000.",
    "estimated_time_seconds": 65,
    "tags": [
      "variation",
      "direct-variation",
      "square-weight"
    ]
  }
]